{
  "schema": "dsh.plugin.report.v1",
  "reportId": "npm:@morlay/session-branch@0.1.5",
  "generatedAt": "2026-10-03T14:53:16.937Z",
  "verifier": {
    "name": "dsh-verified",
    "version": "0.1.0",
    "commit": "9c7ff94c515320018111c26c3f1ae139e555f593"
  },
  "subject": {
    "spec": "@morlay/session-branch@0.1.5",
    "name": "@morlay/session-branch",
    "version": "0.1.5",
    "registry": "https://registry.npmjs.org",
    "tarball": "https://registry.npmjs.org/@morlay/session-branch/-/session-branch-0.1.5.tgz",
    "integrity": "sha512-l2H7RhC7Tw9w2sXB0VZ+FdxNKvYtqT4MaGc6j93THglh+OqtD1qrbeR7lVfSLSo609+LCXo5C4q/g3ahd7OcNQ==",
    "shasum": "56c3a278a0b770e5834445ec0ef516eea93b23dd",
    "repository": "https://github.com/morlay/dsh-plugin.git",
    "license": "MIT",
    "publishedAt": "2026-10-02T10:52:44.685Z"
  },
  "runtime": {
    "dshVersion": "not-executed",
    "nodeVersion": "v24.15.0",
    "os": "darwin",
    "arch": "arm64"
  },
  "container": {
    "image": "none",
    "imageDigest": null,
    "notes": "static-only run in the host process; no container was used"
  },
  "verdict": "not-installable",
  "dimensions": {
    "L0_qualification": {
      "id": "L0",
      "status": "fail",
      "summary": "package.json declares no dsh.bundle.patch, so this is not an installable DSH plugin bundle",
      "metrics": {
        "fileCount": 15,
        "unpackedBytes": 17191,
        "patchPaths": [],
        "declaredEnginesDsh": null,
        "shipsSource": true
      },
      "evidenceRefs": [
        "e-resolve",
        "e-tarball",
        "e-l0"
      ],
      "notes": [
        "dsh.manifestVersion is not declared; the reader does not infer a default"
      ]
    },
    "L1_install": {
      "id": "L1",
      "status": "skip",
      "summary": "not run: installing runs third-party code and requires the verification container",
      "evidenceRefs": [],
      "notes": [
        "skipped by design in a static-only run; requires the verification container"
      ]
    },
    "L2_load": {
      "id": "L2",
      "status": "skip",
      "summary": "not run: loading runs third-party code and requires the verification container",
      "evidenceRefs": [],
      "notes": [
        "skipped by design in a static-only run; requires the verification container"
      ]
    },
    "L3_run": {
      "id": "L3",
      "status": "skip",
      "summary": "not run: a session needs a model or a replay fixture",
      "evidenceRefs": [],
      "notes": [
        "skipped by design in a static-only run; requires the verification container"
      ]
    },
    "L4_capability": {
      "id": "L4",
      "status": "pass",
      "summary": "0 capability signal(s) present across 10 scanned file(s)",
      "metrics": {
        "scannedFiles": 10,
        "scannedBytes": 12949,
        "skippedFiles": 0
      },
      "evidenceRefs": [
        "e-l4"
      ],
      "notes": [
        "static analysis cannot see dynamically constructed code or prove intent"
      ]
    },
    "L5_overhead": {
      "id": "L5",
      "status": "skip",
      "summary": "not run: needs a running host to sample against a baseline",
      "evidenceRefs": [],
      "notes": [
        "skipped by design in a static-only run; requires the verification container"
      ]
    },
    "L6_uninstall": {
      "id": "L6",
      "status": "skip",
      "summary": "not run: needs an installed profile to remove from",
      "evidenceRefs": [],
      "notes": [
        "skipped by design in a static-only run; requires the verification container"
      ]
    }
  },
  "capabilities": [
    {
      "id": "eval_or_dynamic_code",
      "present": false,
      "confidence": "medium",
      "attribution": "unknown",
      "notes": "eval or synthesised code; common and often benign, and frequently bundler output",
      "evidence": []
    },
    {
      "id": "hooks_api_gate",
      "present": false,
      "confidence": "medium",
      "attribution": "unknown",
      "notes": "hooks the API/LLM path, so it can observe or alter provider traffic",
      "evidence": []
    },
    {
      "id": "hooks_system_prompt",
      "present": false,
      "confidence": "medium",
      "attribution": "unknown",
      "notes": "hooks system-prompt assembly, so it can influence what the model is told",
      "evidence": []
    },
    {
      "id": "listens_on_port",
      "present": false,
      "confidence": "high",
      "attribution": "unknown",
      "notes": "opens a listening socket",
      "evidence": []
    },
    {
      "id": "network_egress",
      "present": false,
      "confidence": "medium",
      "attribution": "unknown",
      "notes": "can make outbound network requests",
      "evidence": []
    },
    {
      "id": "reads_secret_env",
      "present": false,
      "confidence": "high",
      "attribution": "unknown",
      "notes": "reads an environment variable whose name looks credential-shaped",
      "evidence": []
    },
    {
      "id": "runtime_patch",
      "present": false,
      "confidence": "medium",
      "attribution": "unknown",
      "notes": "patches runtime objects rather than only registering its own services",
      "evidence": []
    },
    {
      "id": "spawns_process",
      "present": false,
      "confidence": "high",
      "attribution": "unknown",
      "notes": "spawns or would spawn an operating-system process",
      "evidence": []
    },
    {
      "id": "watches_filesystem",
      "present": false,
      "confidence": "high",
      "attribution": "unknown",
      "notes": "watches the filesystem; a recursive workspace watch is the documented cause of host stalls",
      "evidence": []
    },
    {
      "id": "writes_outside_workspace",
      "present": false,
      "confidence": "low",
      "attribution": "unknown",
      "notes": "writes or resolves paths that can fall outside the workspace; heuristic, expect false positives",
      "evidence": []
    }
  ],
  "evidence": [
    {
      "id": "e-resolve",
      "kind": "command",
      "command": "resolve @morlay/session-branch@0.1.5 -> @morlay/session-branch@0.1.5",
      "exitCode": 0,
      "durationMs": 1731,
      "excerpt": "{\n  \"name\": \"@morlay/session-branch\",\n  \"version\": \"0.1.5\",\n  \"registry\": \"https://registry.npmjs.org\",\n  \"tarball\": \"https://registry.npmjs.org/@morlay/session-branch/-/session-branch-0.1.5.tgz\",\n  \"advertisedIntegrity\": \"sha512-l2H7RhC7Tw9w2sXB0VZ+FdxNKvYtqT4MaGc6j93THglh+OqtD1qrbeR7lVfSLSo609+LCXo5C4q/g3ahd7OcNQ==\",\n  \"publishedAt\": \"2026-10-02T10:52:44.685Z\"\n}"
    },
    {
      "id": "e-tarball",
      "kind": "artifact",
      "command": "fetch https://registry.npmjs.org/@morlay/session-branch/-/session-branch-0.1.5.tgz",
      "exitCode": 0,
      "durationMs": 335,
      "excerpt": "{\n  \"bytes\": 5903,\n  \"resolvedIntegrity\": \"sha512-l2H7RhC7Tw9w2sXB0VZ+FdxNKvYtqT4MaGc6j93THglh+OqtD1qrbeR7lVfSLSo609+LCXo5C4q/g3ahd7OcNQ==\",\n  \"advertisedIntegrity\": \"sha512-l2H7RhC7Tw9w2sXB0VZ+FdxNKvYtqT4MaGc6j93THglh+OqtD1qrbeR7lVfSLSo609+LCXo5C4q/g3ahd7OcNQ==\",\n  \"integrityMatchesRegistry\": true,\n  \"sha256\": \"1bfe2527e8a1224b9cf65258d057d28d19cfdddf6a67572690d8ebb0fe87bf15\"\n}",
      "excerptBytes": 381,
      "sha256": "1bfe2527e8a1224b9cf65258d057d28d19cfdddf6a67572690d8ebb0fe87bf15"
    },
    {
      "id": "e-l0",
      "kind": "static",
      "command": "read published package.json and verify declared dsh.bundle.patch paths exist",
      "excerpt": "{\n  \"status\": \"fail\",\n  \"reasons\": [\n    \"package.json declares no dsh.bundle.patch, so this is not an installable DSH plugin bundle\"\n  ],\n  \"declared\": {\n    \"manifestVersion\": null,\n    \"bundlePatch\": null,\n    \"clientPlatform\": null,\n    \"enginesDsh\": null,\n    \"enginesNode\": null\n  },\n  \"missingPatchPaths\": [],\n  \"fileCount\": 15,\n  \"unpackedBytes\": 17191,\n  \"shipsSource\": true\n}",
      "excerptBytes": 385
    },
    {
      "id": "e-l4",
      "kind": "static",
      "command": "scan 10 shipped source file(s) for capability signatures",
      "excerpt": "{\n  \"present\": [],\n  \"scannedFiles\": 10,\n  \"skippedFiles\": 0,\n  \"limits\": [\n    \"static analysis cannot see dynamically constructed code or prove intent\"\n  ]\n}",
      "excerptBytes": 159
    }
  ],
  "redactions": [],
  "disclaimers": [
    "Verification is not a security audit and not an endorsement. It records what was executed and observed on one machine at one time. Absence of a finding is not a finding of absence."
  ],
  "limits": [
    "static analysis cannot see dynamically constructed code or prove intent"
  ]
}
